{
  "$schema": "http://json-schema.org/draft-07/schema#",
  "$id": "https://pentest-lyan/impact.schema.json",
  "title": "Business-impact evidence JSON",
  "description": "Machine-readable verification that a technically proven security-boundary failure produced a real, evidenced business or security impact. This file is the factual basis for later severity grading.",
  "type": "object",
  "additionalProperties": true,
  "required": [
    "verified",
    "verification_method",
    "observed_impact",
    "impact_dimensions",
    "evidence_basis"
  ],
  "properties": {
    "verified": {
      "const": true
    },
    "verification_method": {
      "type": "string",
      "minLength": 10
    },
    "before": {},
    "after": {},
    "observed_impact": {
      "type": "string",
      "minLength": 10
    },
    "impact_dimensions": {
      "type": "object",
      "additionalProperties": false,
      "required": [
        "permissions",
        "affected_objects",
        "data_or_assets",
        "business_result",
        "affected_scope",
        "scalability",
        "prerequisites"
      ],
      "properties": {
        "permissions": {
          "type": "string",
          "minLength": 1,
          "description": "Actual permissions obtained or bypassed, based on observed behavior."
        },
        "affected_objects": {
          "type": "string",
          "minLength": 1,
          "description": "Actual affected users, records, resources, tenants, or object classes."
        },
        "data_or_assets": {
          "type": "string",
          "minLength": 1,
          "description": "Actual data, assets, functions, funds, privileges, or system resources reached."
        },
        "business_result": {
          "type": "string",
          "minLength": 1,
          "description": "Actual business or security result, including final-state verification."
        },
        "affected_scope": {
          "type": "string",
          "minLength": 1,
          "description": "Observed and evidenced impact range; do not replace this with theoretical maximums."
        },
        "scalability": {
          "type": "string",
          "minLength": 1,
          "description": "Observed repeatability or bounded expansion path, including limits and controls."
        },
        "prerequisites": {
          "type": "string",
          "minLength": 1,
          "description": "Actual authentication, role, object, timing, user interaction, or environment prerequisites."
        }
      }
    },
    "evidence_basis": {
      "type": "array",
      "minItems": 1,
      "items": {
        "type": "object",
        "additionalProperties": false,
        "required": [
          "claim",
          "evidence",
          "evidence_refs"
        ],
        "properties": {
          "claim": {
            "type": "string",
            "minLength": 1
          },
          "evidence": {
            "type": "string",
            "minLength": 1,
            "description": "Concrete request, response, state check, log, file, UI observation, or PoC artifact supporting the claim."
          },
          "evidence_refs": {
            "type": "array",
            "minItems": 1,
            "uniqueItems": true,
            "items": {
              "type": "string",
              "minLength": 1
            },
            "description": "Evidence IDs from the confirmed module test that physically support this claim. References must resolve to non-impact evidence files."
          }
        }
      }
    }
  }
}
