{
  "verified": true,
  "verification_method": "Compared the returned object owner and protected content with the attacker identity and the authoritative object state.",
  "observed_impact": "Read one protected test object belonging to another user.",
  "impact_dimensions": {
    "permissions": "Bypassed the object-ownership read boundary as a standard authenticated user.",
    "affected_objects": "One protected test object owned by another test user was directly verified.",
    "data_or_assets": "The protected object owner and object content were disclosed.",
    "business_result": "The attacker account successfully read a protected object that it did not own.",
    "affected_scope": "One cross-user test object was directly demonstrated; broader object coverage was not claimed.",
    "scalability": "The behavior was repeatable for the demonstrated object identifier, but no broader identifier range was asserted.",
    "prerequisites": "A valid standard-user session and knowledge of the victim test object identifier were required."
  },
  "evidence_basis": [
    {
      "claim": "The attacker read a protected object owned by another user.",
      "evidence": "The attack request and response show the attacker session receiving the victim test object's owner and content.",
      "evidence_refs": [
        "EV-demo-T1-request",
        "EV-demo-T1-response"
      ]
    },
    {
      "claim": "The demonstrated scope is one cross-user test object.",
      "evidence": "The authoritative object identity used in the request and returned in the response matches the victim test fixture.",
      "evidence_refs": [
        "EV-demo-T1-request",
        "EV-demo-T1-response"
      ]
    }
  ]
}
